,address,target_building_id,target_address
3252,"Коллонтай, д.6",141557,"г.Санкт-Петербург, улица Коллонтай, дом 6, корпус 1, литера А"
4508,"Суздальское, д.24",222076,"г.Санкт-Петербург, Суздальское шоссе, дом 24, корпус 1, строение 1"
2381,"Посадская, д.3",80115,"г.Санкт-Петербург, Малая Посадская улица, дом 3, литера А"
3603,"Дибуновская, д.19",110947,"г.Санкт-Петербург, Дибуновская улица, дом 19, литера А"
1997,"Адмирала Черокова, д.22",208028,"г.Санкт-Петербург, улица Адмирала Черокова, дом 22, литера А"
2488,"Бабушкина, д.82",54988,"г.Санкт-Петербург, улица Бабушкина, дом 82, литера А"
1539,"Авангардная, д.53",52299,"г.Санкт-Петербург, Авангардная улица, дом 53, литера А"
5027,"Заводской, д.30",80519,"Санкт-Петербург, город Колпино, Заводской проспект, дом 30, литера А"
3500,"Лыжный, д.4",163085,"г.Санкт-Петербург, Лыжный переулок, дом 4, корпус 1, литера А"
3414,"Крыленко, д.2",127074,"г.Санкт-Петербург, улица Крыленко, дом 2, корпус 4, литера А"
1825,"Красногородская, д.11",52381,"Санкт-Петербург, город Красное Село, Красногородская улица, дом 11, корпус 1, литера А"
5781,"Большой Сампсониевский, д.83",111357,"г.Санкт-Петербург, Большой Сампсониевский проспект, дом 83, литера А"
5882,"Просвещения, д.52",62280,"г.Санкт-Петербург, проспект Просвещения, дом 52, корпус 2, литера А"
6489,"Заречная, д.19",205395,"Санкт-Петербург, посёлок Парголово, Заречная улица, дом 19, корпус 1, литера А"
5591,"Дунайский, д.14",205118,"г.Санкт-Петербург, Дунайский проспект, дом 14, корпус 1, литера А"
4906,"Заводской, д.48",52142,"Санкт-Петербург, город Колпино, Заводской проспект, дом 48, литера А"
3689,"Королёва, д.30",63827,"г.Санкт-Петербург, проспект Королёва, дом 30, корпус 1, литера А"
5918,"Руднева, д.8",90841,"г.Санкт-Петербург, улица Руднева, дом 8, корпус 1, литера А"
3853,"Приморский, д.169",80978,"г.Санкт-Петербург, Приморский проспект, дом 169, литера А"
1817,"Красногородская, д.5",13079,"Санкт-Петербург, город Красное Село, Красногородская улица, дом 5, корпус 1, литера А"
261,"Гражданский, д.126",27849,"г.Санкт-Петербург, Гражданский проспект, дом 126, корпус 1, литера А"
71,"Светлановский, д.48/19",124777,"г.Санкт-Петербург, Светлановский проспект, дом 48"
2461,"Карла Либкнехта, д.25",43846,"Санкт-Петербург, город Кронштадт, улица Карла Либкнехта, дом 25, литера А"
1357,"Передовиков, д.3",8660,"г.Санкт-Петербург, улица Передовиков, дом 3, литера А"
3751,"Матроса Железняка, д.1",25274,"г.Санкт-Петербург, улица Матроса Железняка, дом 1, литера А"
2264,"Ленина, д.22",1669,"г.Санкт-Петербург, улица Ленина, дом 22, литера А"
6644,"Манчестерская, д.6",22860,"г.Санкт-Петербург, Манчестерская улица, дом 6, литера А"
1500,"Ветеранов, д.136",33483,"г.Санкт-Петербург, проспект Ветеранов, дом 136, литера А"
1077,"Ленская, д.20",19410,"г.Санкт-Петербург, Ленская улица, дом 20, корпус 1, литера А"
4378,"Приморский, д.11",37462,"г.Санкт-Петербург, Приморский проспект, дом 11, литера А"
3458,"Мебельная, д.21",133763,"г.Санкт-Петербург, Мебельная улица, дом 21, корпус 1, литера А"
3650,"Камышовая, д.12",103116,"г.Санкт-Петербург, Камышовая улица, дом 12, корпус 1, литера А"
4788,"Стахановская, д.20",9917,"Санкт-Петербург, город Колпино, Стахановская улица, дом 20, литера А"
2346,"Сургина, д.7",30803,"Санкт-Петербург, город Кронштадт, улица Сургина, дом 7, литера А"
5570,"Дунайский, д.3",78800,"г.Санкт-Петербург, Дунайский проспект, дом 3, литера А"
6937,"Кедринская, д.12",125841,"Санкт-Петербург, город Пушкин, Кедринская улица, дом 12, литера А"
7155,"Пущинская (Новосёлки тер.), д.3",8183,"Санкт-Петербург, посёлок Левашово, территория Новосёлки, Родниковый переулок, дом 3, литера А"
2999,"Клочков, д.10",42765,"г.Санкт-Петербург, Клочков переулок, дом 10, литера А"
2430,"Флотская, д.2",89577,"Санкт-Петербург, город Кронштадт, Флотская улица, дом 2, литера А"
3526,"Авиаконструкторов, д.44",72784,"г.Санкт-Петербург, проспект Авиаконструкторов, дом 44, корпус 1, литера А"
2163,"Всеволода Вишневского, д.13",13785,"г.Санкт-Петербург, улица Всеволода Вишневского, дом 13, литера А"
27,"Тихорецкий, д.3",47976,"г.Санкт-Петербург, Тихорецкий проспект, дом 3, литера Д"
92,"Северный, д.69/98",54139,"г.Санкт-Петербург, Северный проспект, дом 69/98, литера А"
2467,"Гражданская, д.21",19446,"г.Санкт-Петербург, Гражданская улица, дом 21, литера А"
201,"Верности, д.34",50243,"г.Санкт-Петербург, улица Верности, дом 34, литера А"
330,"Карпинского, д.24",90087,"г.Санкт-Петербург, улица Карпинского, дом 24, литера А"
214,"Верности, д.7",40625,"г.Санкт-Петербург, улица Верности, дом 7, литера А"
4102,"Сердобольская, д.37",100771,"г.Санкт-Петербург, Сердобольская улица, дом 37, литера А"
4103,"Коломяжский, д.12",49407,"г.Санкт-Петербург, Коломяжский проспект, дом 12, литера А"
1733,"Пограничника Гарькавого, д.35",51303,"г.Санкт-Петербург, улица Пограничника Гарькавого, дом 35, корпус 1, литера А"
1027,"Ириновский, д.29",22898,"г.Санкт-Петербург, Ириновский проспект, дом 29, корпус 1, литера А"
3797,"Ольховая, д.12",65723,"г.Санкт-Петербург, Ольховая улица, дом 12, литера А"
4422,"2-я Никитинская, д.57",60639,"г.Санкт-Петербург, 2-я Никитинская улица, дом 57, литера А"
386,"Науки, д.10",29245,"г.Санкт-Петербург, проспект Науки, дом 10, корпус 1, литера А"
2952,"Ольминского, д.22",42712,"г.Санкт-Петербург, улица Ольминского, дом 22, литера А"
5700,"Асафьева, д.6",85932,"г.Санкт-Петербург, улица Асафьева, дом 6, корпус 1, литера А"
1486,"Политрука Пасечника (Торики), д.2",24952,"г.Санкт-Петербург, Торики, улица Политрука Пасечника, дом 2, литера А"
5419,"Тазаева, д.26",20955,"Санкт-Петербург, город Колпино, улица Тазаева, дом 26, литера А"
5447,"Полевая, д.5",86894,"г.Санкт-Петербург, Лахта, Полевая улица, дом 5, литера А"
6986,"Огородная, д.3",124215,"Санкт-Петербург, город Пушкин, Огородная улица, дом 3, литера А"
3013,"Пятилеток, д.17",81416,"г.Санкт-Петербург, проспект Пятилеток, дом 17, корпус 1, литера А"
5146,"Павловская, д.17/16",7106,"Санкт-Петербург, город Колпино, Павловская улица, дом 17, литера А"
3059,"3-й Рабфаковский, д.8",101180,"г.Санкт-Петербург, 3-й Рабфаковский переулок, дом 8, литера У"
2187,"Гражданская, д.9",198616,"г.Санкт-Петербург, Гражданская улица, дом 9, литера А"
4975,"Тазаева, д.7",23542,"Санкт-Петербург, город Колпино, улица Тазаева, дом 7, литера А"
6776,"Народного Ополчения, д.29",70709,"г.Санкт-Петербург, проспект Народного Ополчения, дом 29, литера А"
4049,"Щербакова, д.6",39682,"г.Санкт-Петербург, улица Щербакова, дом 6, литера А"
4332,"Богатырский, д.36",68597,"г.Санкт-Петербург, Богатырский проспект, дом 36, корпус 1, литера А"
4228,"Камышовая, д.48",43505,"г.Санкт-Петербург, Камышовая улица, дом 48, корпус 1, литера А"
4801,"Трудящихся, д.17",82864,"Санкт-Петербург, город Колпино, бульвар Трудящихся, дом 17, литера А"
5810,"Кустодиева, д.2",54159,"г.Санкт-Петербург, улица Кустодиева, дом 2, литера А"
4090,"Старобельская, д.4",198939,"г.Санкт-Петербург, Старобельская улица, дом 4, литера А"
365,"Лужская, д.10",54561,"г.Санкт-Петербург, Лужская улица, дом 10, корпус 1, литера А"
2150,"Аммермана, д.26",99707,"Санкт-Петербург, город Кронштадт, улица Аммермана, дом 26, литера А"
4865,"Октябрьская, д.3",7822,"Санкт-Петербург, город Ломоносов, Октябрьская улица, дом 3, литера А"
1650,"Народного Ополчения, д.243",51163,"г.Санкт-Петербург, проспект Народного Ополчения, дом 243, корпус 1, литера А"
2129,"Ленинский, д.32",,
2985,"Подвойского, д.34",111523,"г.Санкт-Петербург, улица Подвойского, дом 34, корпус 1, литера А"
3482,"Торжковская, д.3",99493,"г.Санкт-Петербург, Торжковская улица, дом 3, литера А"
820,"Непокорённых, д.4",107838,"г.Санкт-Петербург, проспект Непокорённых, дом 4, литера А"
2908,"Латышских Стрелков, д.11",63151,"г.Санкт-Петербург, улица Латышских Стрелков, дом 11, корпус 1, литера А"
1721,"Политрука Пасечника (Торики), д.9",28471,"г.Санкт-Петербург, Торики, улица Политрука Пасечника, дом 9, литера А"
5571,"Взлётная, д.11",98546,"г.Санкт-Петербург, Взлётная улица, дом 11, литера А"
5852,"Придорожная, д.17",41327,"г.Санкт-Петербург, Придорожная аллея, дом 17, литера А"
2946,"Обуховской Обороны, д.89",47232,"г.Санкт-Петербург, проспект Обуховской Обороны, дом 89, литера А"
6283,"Суздальский, д.65",1343,"г.Санкт-Петербург, Суздальский проспект, дом 65, литера А"
3881,"Савушкина, д.12",11789,"г.Санкт-Петербург, улица Савушкина, дом 12, литера А"
1158,"Помяловского, д.5",31811,"г.Санкт-Петербург, улица Помяловского, дом 5, литера А"
1136,"Осипенко, д.5",100228,"г.Санкт-Петербург, улица Осипенко, дом 5, корпус 1, литера А"
6021,"Художников, д.23",23244,"г.Санкт-Петербург, проспект Художников, дом 23, корпус 1, литера А"
3,"Вавиловых, д.10",45187,"г.Санкт-Петербург, улица Вавиловых, дом 10, корпус 1, литера А"
3519,"Авиаконструкторов, д.31",19077,"г.Санкт-Петербург, проспект Авиаконструкторов, дом 31, корпус 1, литера А"
480,"Софьи Ковалевской, д.10",98415,"г.Санкт-Петербург, улица Софьи Ковалевской, дом 10, корпус 1, литера А"
5052,"Комсомольского канала, д.20/2",64275,"Санкт-Петербург, город Колпино, набережная Комсомольского канала, дом 20/2, литера А"
1453,"Чекистов, д.13",65730,"г.Санкт-Петербург, улица Чекистов, дом 13, литера А"
1292,"Энтузиастов, д.49",72940,"г.Санкт-Петербург, проспект Энтузиастов, дом 49, корпус 1, литера А"
684,"Киришская, д.5",8279,"г.Санкт-Петербург, Киришская улица, дом 5, литера А"
5672,"Пархоменко, д.5",36144,"г.Санкт-Петербург, проспект Пархоменко, дом 5, литера А"
4458,"Омская, д.24",16705,"г.Санкт-Петербург, Омская улица, дом 24, литера А"
2948,"Реки Оккервиль, д.8",4629,"г.Санкт-Петербург, набережная реки Оккервиль, дом 8, литера А"
1542,"Авангардная, д.9",58724,"г.Санкт-Петербург, Авангардная улица, дом 9, литера А"
5452,"Братьев Радченко, д.19",39409,"Санкт-Петербург, город Колпино, улица Братьев Радченко, дом 19, литера А"
4595,"Приморский, д.23",65663,"г.Санкт-Петербург, Приморский проспект, дом 23, литера А"
2742,"Ворошилова, д.11",16223,"Санкт-Петербург, муниципальный округ Правобережный, улица Ворошилова, дом 11, литера А"
1820,"Красногородская, д.13",107427,"Санкт-Петербург, город Красное Село, Красногородская улица, дом 13, корпус 1, литера А"
1088,"Металлистов, д.23",55489,"г.Санкт-Петербург, проспект Металлистов, дом 23, корпус 1, литера А"
6773,"Народного Ополчения, д.23",105920,"г.Санкт-Петербург, проспект Народного Ополчения, дом 23, литера А"
1570,"Добровольцев, д.62",53774,"г.Санкт-Петербург, улица Добровольцев, дом 62, литера А"
2535,"Гранитная, д.46",91570,"г.Санкт-Петербург, Гранитная улица, дом 46, корпус 1, литера А"
6767,"Трамвайный, д.27",6397,"г.Санкт-Петербург, Трамвайный проспект, дом 27, корпус 1, литера А"
1866,"Театральная, д.3",188219,"г.Санкт-Петербург, Театральная аллея, дом 3, литера А"
1111,"Наставников, д.17",1657,"г.Санкт-Петербург, проспект Наставников, дом 17, корпус 1, литера А"
2649,"Александровской Фермы, д.9",2929,"г.Санкт-Петербург, проспект Александровской Фермы, дом 9, литера Д"
2511,"Новочеркасский, д.9",5353,"г.Санкт-Петербург, Новочеркасский проспект, дом 9, литера А"
4251,"Королёва, д.7",124653,"г.Санкт-Петербург, проспект Королёва, дом 7, литера А"
880,"Гжатская, д.9",56607,"г.Санкт-Петербург, Гжатская улица, дом 9, литера А"
5932,"Светлановский, д.119",87314,"г.Санкт-Петербург, Светлановский проспект, дом 119, литера А"
6898,"Железнодорожная, д.40",124210,"Санкт-Петербург, город Пушкин, Железнодорожная улица, дом 40, литера А"
4261,"Туристская, д.30",130967,"г.Санкт-Петербург, Туристская улица, дом 30, корпус 1, литера А"
242,"Гражданский, д.113",24439,"г.Санкт-Петербург, Гражданский проспект, дом 113, корпус 1, литера А"
2829,"Искровский, д.23",12952,"г.Санкт-Петербург, Искровский проспект, дом 23, корпус 1, литера А"
4400,"Савушкина, д.131",45889,"г.Санкт-Петербург, улица Савушкина, дом 131, литера А"
1464,"Коммунаров (Горелово), д.124",55373,"Санкт-Петербург, муниципальный округ Горелово, территория Горелово, улица Коммунаров, дом 124, литера А"
4662,"Королёва, д.26",100328,"г.Санкт-Петербург, проспект Королёва, дом 26, корпус 1, литера А"
730,"Науки, д.9",110622,"г.Санкт-Петербург, проспект Науки, дом 9, литера А"
4741,"Софийская, д.21",52566,"г.Санкт-Петербург, Софийская улица, дом 21, корпус 1, литера А"
5227,"Тверская, д.8",71417,"г.Санкт-Петербург, Тверская улица, дом 8, литера А"
120,"Тихорецкий, д.27",55240,"г.Санкт-Петербург, Тихорецкий проспект, дом 27, литера А"
3951,"Сизова, д.20",97048,"г.Санкт-Петербург, проспект Сизова, дом 20, корпус 1, литера А"
1938,"Адмирала Трибуца, д.10",208688,"г.Санкт-Петербург, улица Адмирала Трибуца, дом 10, литера А"
2621,"Шаумяна, д.46",110775,"г.Санкт-Петербург, проспект Шаумяна, дом 46, литера А"
5902,"Просвещения, д.9",130587,"г.Санкт-Петербург, проспект Просвещения, дом 9, литера А"
2224,"Красная, д.11",79614,"Санкт-Петербург, город Кронштадт, Красная улица, дом 11, литера А"
623,"Гжатская, д.5",95074,"г.Санкт-Петербург, Гжатская улица, дом 5, литера А"
976,"Белорусская, д.12",11987,"г.Санкт-Петербург, Белорусская улица, дом 12, корпус 1, литера А"
1511,"Ветеранов, д.151",30629,"г.Санкт-Петербург, проспект Ветеранов, дом 151, корпус 1, литера А"
5807,"Кустодиева, д.12",28615,"г.Санкт-Петербург, улица Кустодиева, дом 12, литера А"
4079,"Гаккелевская, д.30",22469,"г.Санкт-Петербург, Гаккелевская улица, дом 30, литера А"
1561,"Добровольцев, д.48",15107,"г.Санкт-Петербург, улица Добровольцев, дом 48, литера А"
3707,"Котельникова, д.3",94924,"г.Санкт-Петербург, аллея Котельникова, дом 3, литера А"
1311,"Осипенко, д.10",4485,"г.Санкт-Петербург, улица Осипенко, дом 10, корпус 1, литера А"
3164,"Фарфоровская, д.22",6716,"г.Санкт-Петербург, Фарфоровская улица, дом 22, литера Ш"
6532,"Поэтический, д.21/10",77184,"г.Санкт-Петербург, Поэтический бульвар, дом 21/10, литера А"
4570,"Приморский, д.54",51675,"г.Санкт-Петербург, Приморский проспект, дом 54, корпус 1, литера А"
2265,"Ленина, д.24",198905,"г.Санкт-Петербург, улица Ленина, дом 24, литера А"
38,"Институтский, д.29",80342,"г.Санкт-Петербург, Институтский проспект, дом 29, литера А"
6961,"Ленинградская, д.99",12139,"Санкт-Петербург, город Пушкин, Ленинградская улица, дом 99, литера А"
4449,"Ланское, д.25",25398,"г.Санкт-Петербург, Ланское шоссе, дом 25, литера А"
5939,"Светлановский, д.62",28098,"г.Санкт-Петербург, Светлановский проспект, дом 62, корпус 1, литера А"
3585,"Гаккелевская, д.18",39383,"г.Санкт-Петербург, Гаккелевская улица, дом 18, корпус 1, литера А"
1231,"Ударников, д.49",10908,"г.Санкт-Петербург, проспект Ударников, дом 49, корпус 1, литера А"
290,"Гражданский, д.4",89850,"г.Санкт-Петербург, Гражданский проспект, дом 4, корпус 1, литера А"
1560,"Добровольцев, д.46",71102,"г.Санкт-Петербург, улица Добровольцев, дом 46, литера А"
6110,"Брянцева, д.17",12961,"г.Санкт-Петербург, улица Брянцева, дом 17, литера А"
6309,"Тимуровская, д.6",68460,"г.Санкт-Петербург, Тимуровская улица, дом 6, корпус 1, литера А"
957,"Передовиков, д.9",58531,"г.Санкт-Петербург, улица Передовиков, дом 9, литера А"
1524,"Авангардная, д.18",107240,"г.Санкт-Петербург, Авангардная улица, дом 18, корпус 1, литера А"
7102,"Берёзовая, д.20",92425,"г.Санкт-Петербург, 1-я Берёзовая аллея, дом 20, литера А"
823,"2-й Муринский, д.47",41888,"г.Санкт-Петербург, 2-й Муринский проспект, дом 47, литера И"
4507,"Суздальское, д.22",221972,"г.Санкт-Петербург, Суздальское шоссе, дом 22, корпус 2, строение 1"
3763,"Мартыновская, д.2",15185,"г.Санкт-Петербург, Мартыновская улица, дом 2, литера А"
6340,"Ярославский, д.66",106080,"г.Санкт-Петербург, Ярославский проспект, дом 66, корпус 1, литера А"
4135,"Ситцевая, д.11",84383,"г.Санкт-Петербург, Ситцевая улица, дом 11, корпус 1, литера А"
3222,"Коллонтай, д.17",1423,"г.Санкт-Петербург, улица Коллонтай, дом 17, корпус 1, литера А"
4328,"Афанасьевская, д.6",75291,"г.Санкт-Петербург, Афанасьевская улица, дом 6, корпус 1, литера А"
1360,"Ириновский, д.34",208065,"г.Санкт-Петербург, Ириновский проспект, дом 34, литера А"
3597,"Глухарская, д.5",41088,"г.Санкт-Петербург, Глухарская улица, дом 5, корпус 1, литера А"
6638,"Фёдора Абрамова, д.20",205219,"Санкт-Петербург, посёлок Парголово, улица Фёдора Абрамова, дом 20, корпус 1, литера А"
5495,"Костюшко, д.13",99465,"г.Санкт-Петербург, улица Костюшко, дом 13, корпус 1, литера А"
