,address,target_building_id,target_address
4582,"Матроса Железняка, д.51",62947,"г.Санкт-Петербург, улица Матроса Железняка, дом 51, литера А"
3573,"Богатырский, д.53",99473,"г.Санкт-Петербург, Богатырский проспект, дом 53, корпус 1, литера А"
3345,"Глазурная, д.2",75445,"г.Санкт-Петербург, Глазурная улица, дом 2, литера А"
317,"Гражданский, д.92",43552,"г.Санкт-Петербург, Гражданский проспект, дом 92, корпус 1, литера А"
4815,"Трудящихся, д.19",53988,"Санкт-Петербург, город Колпино, бульвар Трудящихся, дом 19, литера А"
4451,"Ланское, д.29",62033,"г.Санкт-Петербург, Ланское шоссе, дом 29, литера А"
3809,"Планерная, д.43",50609,"г.Санкт-Петербург, Планерная улица, дом 43, корпус 1, литера А"
2378,"Посадская, д.21",47510,"г.Санкт-Петербург, Малая Посадская улица, дом 21, литера А"
5263,"Пролетарская, д.17/42",138698,"г.Санкт-Петербург, Сергиево, Пролетарская улица, дом 17, литера А"
2647,"Александровской Фермы, д.4",76505,"г.Санкт-Петербург, проспект Александровской Фермы, дом 4, литера А"
3706,"Котельникова, д.1",127937,"г.Санкт-Петербург, аллея Котельникова, дом 1, литера А"
6274,"Ольги Форш, д.5",71801,"г.Санкт-Петербург, улица Ольги Форш, дом 5, литера А"
3542,"Байконурская, д.5",48581,"г.Санкт-Петербург, Байконурская улица, дом 5, корпус 1, литера А"
5118,"Новгородская, д.6",103431,"Санкт-Петербург, город Колпино, Новгородская улица, дом 6, корпус 1, литера А"
1616,"2-я Комсомольская, д.6",58016,"г.Санкт-Петербург, 2-я Комсомольская улица, дом 6, корпус 1, литера А"
2344,"Сургина, д.15",196805,"Санкт-Петербург, город Кронштадт, улица Сургина, дом 15"
3431,"Гранитная, д.36",8737,"г.Санкт-Петербург, Гранитная улица, дом 36, литера А"
1855,"Маршала Казакова, д.44",116832,"г.Санкт-Петербург, улица Маршала Казакова, дом 44, корпус 1, литера А"
4800,"Танкистов, д.8",10571,"Санкт-Петербург, город Колпино, улица Танкистов, дом 8, литера А"
6356,"Художников, д.10",37198,"г.Санкт-Петербург, проспект Художников, дом 10, корпус 1, литера А"
5569,"Пулковское, д.105",43553,"г.Санкт-Петербург, Пулковское шоссе, дом 105, литера А"
4977,"Танкистов, д.10",205153,"Санкт-Петербург, город Зеленогорск, улица Танкистов, дом 10, корпус 1, литера А"
2059,"Современников, д.11/6",58092,"Санкт-Петербург, город Павловск, Звериницкая улица, дом 11/8, литера А"
663,"Даниила Хармса, д.7",204805,"г.Санкт-Петербург, улица Даниила Хармса, дом 7, литера А"
1531,"Авангардная, д.33",65867,"г.Санкт-Петербург, Авангардная улица, дом 33, литера А"
6740,"Новаторов, д.44",96015,"г.Санкт-Петербург, бульвар Новаторов, дом 44, литера А"
1411,"Большеохтинский, д.10",29133,"г.Санкт-Петербург, Большеохтинский проспект, дом 10, литера А"
3018,"Пятилеток, д.6",58700,"г.Санкт-Петербург, проспект Пятилеток, дом 6, корпус 1, литера А"
3029,"1-й Рабфаковский, д.5",197937,"г.Санкт-Петербург, 1-й Рабфаковский переулок, дом 5, литера А"
6741,"Новаторов, д.8",27313,"г.Санкт-Петербург, бульвар Новаторов, дом 8, литера А"
1861,"Ленинский, д.76",71566,"г.Санкт-Петербург, Ленинский проспект, дом 76, корпус 1, литера А"
6329,"Ушинского, д.22/97",22365,"г.Санкт-Петербург, улица Ушинского, дом 22/97, литера А"
1113,"Наставников, д.21",130685,"г.Санкт-Петербург, проспект Наставников, дом 21, литера А"
4969,"Ремизова, д.15",15815,"Санкт-Петербург, город Колпино, улица Ремизова, дом 15, литера А"
6957,"Петербургское, д.5",100376,"Санкт-Петербург, город Пушкин, Петербургское шоссе, дом 5, литера А"
2064,"Петергофское, д.72",33089,"г.Санкт-Петербург, Петергофское шоссе, дом 72, литера А"
6166,"Культуры, д.15",55172,"г.Санкт-Петербург, проспект Культуры, дом 15, корпус 1, литера А"
2651,"Антонова-Овсеенко, д.11",36814,"г.Санкт-Петербург, улица Антонова-Овсеенко, дом 11, корпус 1, литера А"
4621,"Королёва, д.45",42509,"г.Санкт-Петербург, проспект Королёва, дом 45, корпус 1, литера А"
2494,"Ворошилова, д.27",139685,"Санкт-Петербург, муниципальный округ Правобережный, улица Ворошилова, дом 27, корпус 1, литера А"
6827,"Оранжерейная, д.46",113406,"Санкт-Петербург, город Пушкин, Оранжерейная улица, дом 46, литера А"
4907,"Заводской, д.54",76690,"Санкт-Петербург, город Колпино, Заводской проспект, дом 54, литера А"
3709,"Котельникова, д.5",47120,"г.Санкт-Петербург, аллея Котельникова, дом 5, корпус 1, литера А"
1670,"Партизана Германа, д.30",102110,"г.Санкт-Петербург, улица Партизана Германа, дом 30, литера А"
248,"Гражданский, д.116",33288,"г.Санкт-Петербург, Гражданский проспект, дом 116, корпус 1, литера А"
7116,"Магазейная, д.50/37",37082,"Санкт-Петербург, город Пушкин, Магазейная улица, дом 50"
3775,"Маршала Новикова, д.6",4020,"г.Санкт-Петербург, улица Маршала Новикова, дом 6, корпус 1, литера А"
5971,"Сикейроса, д.21",16394,"г.Санкт-Петербург, улица Сикейроса, дом 21, корпус 1, литера А"
2549,"Заневский, д.18",55085,"г.Санкт-Петербург, Заневский проспект, дом 18, литера А"
320,"Карпинского, д.10",34246,"г.Санкт-Петербург, улица Карпинского, дом 10, литера А"
1346,"6-я Жерновская, д.9",138646,"г.Санкт-Петербург, 6-я Жерновская улица, дом 9, литера А"
935,"Лабораторный, д.23",140280,"г.Санкт-Петербург, Лабораторный проспект, дом 23, корпус 2, литера А"
2603,"Таллинская, д.24",31187,"г.Санкт-Петербург, Таллинская улица, дом 24, литера А"
6899,"Железнодорожная, д.6/18",28598,"Санкт-Петербург, посёлок Левашово, Железнодорожная улица, дом 6, литера А"
1069,"Ленская, д.13",88876,"г.Санкт-Петербург, Ленская улица, дом 13, литера А"
3199,"Шотмана, д.3",80814,"г.Санкт-Петербург, улица Шотмана, дом 3, литера А"
3232,"Ткачей, д.68",23398,"г.Санкт-Петербург, улица Ткачей, дом 68, корпус 2, литера А"
1322,"Косыгина, д.17",127061,"г.Санкт-Петербург, проспект Косыгина, дом 17, корпус 1, литера А"
5319,"Загородная, д.34",112956,"Санкт-Петербург, город Колпино, Загородная улица, дом 34, литера А"
956,"Передовиков, д.13",21199,"г.Санкт-Петербург, улица Передовиков, дом 13, литера А"
4626,"Студенческая, д.24",215765,"г.Санкт-Петербург, Студенческая улица, дом 24, корпус 1, строение 1"
6204,"Луначарского, д.17",96187,"г.Санкт-Петербург, проспект Луначарского, дом 17, литера А"
1776,"Тамбасова, д.4",130180,"г.Санкт-Петербург, улица Тамбасова, дом 4, литера А"
4832,"Тельмана, д.19",,
888,"Карбышева, д.8",750,"г.Санкт-Петербург, улица Карбышева, дом 8, литера П"
4721,"Ипподромный, д.1",222409,"Санкт-Петербург, муниципальный округ Комендантский аэродром, Ипподромный переулок, дом 1, корпус 1, строение 1"
2504,"Коллонтай, д.5/1",139330,"г.Санкт-Петербург, улица Коллонтай, дом 5"
1805,"2-я Комсомольская, д.9",104354,"г.Санкт-Петербург, 2-я Комсомольская улица, дом 9, корпус 1, литера А"
3749,"Льва Мациевича, д.2",75961,"г.Санкт-Петербург, площадь Льва Мациевича, дом 2, литера А"
1364,"Косыгина, д.19",2955,"г.Санкт-Петербург, проспект Косыгина, дом 19, корпус 1, литера А"
606,"Верности, д.6",66910,"г.Санкт-Петербург, улица Верности, дом 6, корпус 1, литера А"
4599,"Матроса Железняка, д.43",39003,"г.Санкт-Петербург, улица Матроса Железняка, дом 43, литера А"
1510,"Ветеранов, д.150",81821,"г.Санкт-Петербург, проспект Ветеранов, дом 150, литера А"
2085,"Тамбасова, д.28",76573,"г.Санкт-Петербург, улица Тамбасова, дом 28, литера А"
1338,"Металлистов, д.15",46202,"г.Санкт-Петербург, проспект Металлистов, дом 15, литера А"
5743,"Есенина, д.14",99272,"г.Санкт-Петербург, улица Есенина, дом 14, корпус 1, литера А"
2405,"Широкая, д.8",41712,"Санкт-Петербург, город Пушкин, Широкая улица, дом 8, литера А"
2393,"Посадская, д.8/36",3931,"г.Санкт-Петербург, Малая Посадская улица, дом 8, литера А"
2193,"Гусева, д.4",103299,"г.Санкт-Петербург, Гусева улица, дом 4, литера А"
3674,"Камышовая, д.7",107776,"г.Санкт-Петербург, Камышовая улица, дом 7, литера А"
2845,"Искровский, д.8",98817,"г.Санкт-Петербург, Искровский проспект, дом 8, литера А"
7057,"Малиновская, д.15",25507,"Санкт-Петербург, город Пушкин, Малиновская улица, дом 15, литера А"
5579,"Штурманская, д.16",24387,"г.Санкт-Петербург, Штурманская улица, дом 16, корпус 1, литера А"
5787,"Композиторов, д.15",35453,"г.Санкт-Петербург, улица Композиторов, дом 15, литера А"
1421,"Свердловская, д.60",124845,"г.Санкт-Петербург, Свердловская набережная, дом 60, литера А"
6803,"Двинская, д.10",70583,"г.Санкт-Петербург, Двинская улица, дом 10, литера А"
2156,"Велещинского, д.12",196807,"Санкт-Петербург, город Кронштадт, улица Велещинского, дом 12, литера А"
5996,"Удельный, д.45",32522,"г.Санкт-Петербург, Удельный проспект, дом 45, литера А"
6143,"Демьяна Бедного, д.29",102951,"г.Санкт-Петербург, улица Демьяна Бедного, дом 29, литера А"
4351,"Ланское, д.10",61669,"г.Санкт-Петербург, Ланское шоссе, дом 10, корпус 1, литера А"
3949,"Серебряков, д.9",34923,"г.Санкт-Петербург, Серебряков переулок, дом 9, литера А"
2249,"Кронштадтское, д.34",67858,"Санкт-Петербург, город Кронштадт, Кронштадтское шоссе, дом 34, литера А"
3093,"Седова, д.87",73323,"г.Санкт-Петербург, улица Седова, дом 87, корпус 1, литера З"
5692,"Валерия Гаврилина, д.5",139497,"Санкт-Петербург, посёлок Парголово, улица Валерия Гаврилина, дом 5, литера А"
1592,"2-я Комсомольская, д.19",89578,"г.Санкт-Петербург, 2-я Комсомольская улица, дом 19, корпус 1, литера А"
828,"Гражданский, д.118",62830,"г.Санкт-Петербург, Гражданский проспект, дом 118, корпус 1, литера А"
1857,"Гатчинское, д.2",8883,"Санкт-Петербург, город Красное Село, Гатчинское шоссе, дом 2, литера А"
1980,"Ветеранов, д.130",24306,"г.Санкт-Петербург, проспект Ветеранов, дом 130, литера А"
4908,"Заводской, д.56",40087,"Санкт-Петербург, город Колпино, Заводской проспект, дом 56, литера А"
3636,"Испытателей, д.26",70106,"г.Санкт-Петербург, проспект Испытателей, дом 26, литера А"
3298,"Таллинская, д.6б",13330,"г.Санкт-Петербург, Таллинская улица, дом 6б, литера А"
3024,"Рабфаковская, д.3",53177,"г.Санкт-Петербург, Рабфаковская улица, дом 3, корпус 1, литера С"
5071,"Ленина, д.21",197335,"Санкт-Петербург, посёлок Шушары, улица Ленина, дом 21, литера А"
5989,"Сиреневый, д.9",198991,"г.Санкт-Петербург, Сиреневый бульвар, дом 9, литера А"
4948,"Павловская, д.72",14971,"Санкт-Петербург, город Колпино, Павловская улица, дом 72, литера А"
4112,"Авиаконструкторов, д.49",69896,"г.Санкт-Петербург, проспект Авиаконструкторов, дом 49, литера А"
6139,"Демьяна Бедного, д.26",17154,"г.Санкт-Петербург, улица Демьяна Бедного, дом 26, корпус 1, литера А"
6179,"Культуры, д.23",84320,"г.Санкт-Петербург, проспект Культуры, дом 23, корпус 1, литера А"
4905,"Заводской, д.40",40662,"Санкт-Петербург, город Колпино, Заводской проспект, дом 40, литера А"
2520,"Чудновского, д.17",26294,"г.Санкт-Петербург, улица Чудновского, дом 17, литера А"
3548,"Беговая, д.5",25909,"г.Санкт-Петербург, Беговая улица, дом 5, корпус 1, литера А"
6355,"Энгельса, д.134",87359,"г.Санкт-Петербург, проспект Энгельса, дом 134, корпус 1, литера А"
6793,"Народного Ополчения, д.63",107888,"г.Санкт-Петербург, проспект Народного Ополчения, дом 63, литера А"
975,"Свердловская, д.64",15526,"г.Санкт-Петербург, Свердловская набережная, дом 64, литера А"
3810,"Планерная, д.45",198942,"г.Санкт-Петербург, Планерная улица, дом 45, корпус 1, литера А"
6442,"Приозерское (Осиновая Роща), д.12",125701,"Санкт-Петербург, посёлок Парголово, территория Осиновая Роща, Приозерское шоссе, дом 12, корпус 1, литера А"
661,"Даниила Хармса, д.5",204797,"г.Санкт-Петербург, улица Даниила Хармса, дом 5, корпус 1, литера А"
7045,"Красносельское, д.18",118009,"Санкт-Петербург, город Пушкин, Красносельское шоссе, дом 18, корпус 1, литера А"
5013,"Вокзальная, д.11",198698,"Санкт-Петербург, город Колпино, Вокзальная улица, дом 11, литера А"
4941,"Оборонная, д.4",134398,"Санкт-Петербург, город Колпино, Оборонная улица, дом 4, корпус 2, литера А"
5231,"Тосненский, д.14",48060,"Санкт-Петербург, город Колпино, Тосненский переулок, дом 14, литера А"
4955,"Павловская, д.96",42314,"Санкт-Петербург, город Колпино, Павловская улица, дом 96, литера А"
5102,"Машиностроителей, д.5",69294,"Санкт-Петербург, город Колпино, улица Машиностроителей, дом 5, литера А"
5451,"Заводской, д.60",113557,"Санкт-Петербург, город Колпино, Заводской проспект, дом 60, литера А"
3286,"Дальневосточный, д.8",206970,"г.Санкт-Петербург, Дальневосточный проспект, дом 8, корпус 1, литера А"
3360,"Товарищеский, д.14",100782,"г.Санкт-Петербург, Товарищеский проспект, дом 14, литера А"
1809,"Пионерстроя, д.27",47591,"г.Санкт-Петербург, улица Пионерстроя, дом 27, литера А"
3782,"2-я Никитинская, д.60",60872,"г.Санкт-Петербург, 2-я Никитинская улица, дом 60, литера А"
1684,"Партизана Германа, д.43",105088,"г.Санкт-Петербург, улица Партизана Германа, дом 43, литера А"
2251,"Кронштадтское, д.38",19169,"Санкт-Петербург, город Кронштадт, Кронштадтское шоссе, дом 38, литера А"
4388,"Приморский, д.9",105857,"г.Санкт-Петербург, Приморский проспект, дом 9, литера А"
6696,"Поэтический, д.1",36137,"г.Санкт-Петербург, Поэтический бульвар, дом 1, корпус 1, литера А"
4810,"Трудящихся, д.3",69719,"Санкт-Петербург, город Колпино, бульвар Трудящихся, дом 3, литера А"
2,"Бутлерова, д.8",13658,"г.Санкт-Петербург, улица Бутлерова, дом 8, литера А"
4408,"Савушкина, д.70",37087,"г.Санкт-Петербург, улица Савушкина, дом 70, литера А"
2369,"Флотская, д.5",51448,"Санкт-Петербург, город Кронштадт, Флотская улица, дом 5, литера А"
4402,"Савушкина, д.41",13037,"г.Санкт-Петербург, улица Савушкина, дом 41, литера А"
6964,"Пулковское, д.31",197859,"Санкт-Петербург, посёлок Шушары, Пулковское, дом 31, литера А"
3074,"Седова, д.128",105205,"г.Санкт-Петербург, улица Седова, дом 128, литера Ф"
3712,"Комендантский, д.14",52810,"г.Санкт-Петербург, Комендантский проспект, дом 14, корпус 1, литера А"
6381,"Сиреневый, д.15",16917,"г.Санкт-Петербург, Сиреневый бульвар, дом 15, литера А"
4677,"Яхтенная, д.34",214876,"г.Санкт-Петербург, Яхтенная улица, дом 34, строение 1"
1527,"Авангардная, д.24",21474,"г.Санкт-Петербург, Авангардная улица, дом 24, литера А"
7053,"Красносельское, д.67",52255,"Санкт-Петербург, город Пушкин, Красносельское шоссе, дом 67, литера А"
4339,"Дибуновская, д.9",47553,"г.Санкт-Петербург, Дибуновская улица, дом 9, литера А"
2100,"2-я Комсомольская, д.25",5871,"г.Санкт-Петербург, 2-я Комсомольская улица, дом 25, корпус 1, литера А"
2543,"Гранитная, д.60",95884,"г.Санкт-Петербург, Гранитная улица, дом 60, литера А"
7096,"Лесное, д.7",44028,"Санкт-Петербург, город Пушкин, Лесное, дом 7, литера А"
6584,"Приозерское (Осиновая Роща), д.13",4969,"Санкт-Петербург, посёлок Парголово, территория Осиновая Роща, Приозерское шоссе, дом 13, литера А"
712,"Тореза, д.30",87882,"г.Санкт-Петербург, проспект Тореза, дом 30, литера З"
136,"Тореза, д.20",36739,"г.Санкт-Петербург, проспект Тореза, дом 20, литера А"
665,"Маршака, д.12",204803,"г.Санкт-Петербург, проспект Маршака, дом 12, корпус 2, литера А"
4743,"Фучика, д.15",81730,"г.Санкт-Петербург, улица Фучика, дом 15, литера А"
2989,"Подвойского, д.40",83819,"г.Санкт-Петербург, улица Подвойского, дом 40, корпус 1, литера Н"
5166,"Пролетарская, д.109",16692,"Санкт-Петербург, город Колпино, Пролетарская улица, дом 109, литера А"
4664,"Савушкина, д.145",49611,"г.Санкт-Петербург, улица Савушкина, дом 145, литера А"
6351,"Сахарный, д.2/35",83454,"г.Санкт-Петербург, Сахарный переулок, дом 2"
5695,"Асафьева, д.10",79815,"г.Санкт-Петербург, улица Асафьева, дом 10, литера А"
1720,"Политрука Пасечника (Торики), д.7",60416,"г.Санкт-Петербург, Торики, улица Политрука Пасечника, дом 7, литера А"
5224,"Тверская, д.47",92590,"Санкт-Петербург, город Колпино, Тверская улица, дом 47, литера А"
5051,"Комсомольского канала, д.17",50978,"Санкт-Петербург, город Колпино, набережная Комсомольского канала, дом 17, литера А"
1863,"Спирина, д.9",114959,"Санкт-Петербург, город Красное Село, улица Спирина, дом 9, корпус 1, литера А"
5920,"Саратовская, д.27",60602,"г.Санкт-Петербург, Саратовская улица, дом 27, литера А"
5338,"Загородная, д.58",91728,"Санкт-Петербург, город Колпино, Загородная улица, дом 58, литера А"
1482,"Политрука Пасечника (Торики), д.11",24006,"г.Санкт-Петербург, Торики, улица Политрука Пасечника, дом 11, корпус 1, литера А"
2600,"Таллинская, д.17",9396,"г.Санкт-Петербург, Таллинская улица, дом 17, литера А"
5145,"Павловская, д.15",65282,"Санкт-Петербург, город Колпино, Павловская улица, дом 15, литера А"
2577,"Новочеркасский, д.26/16",7604,"г.Санкт-Петербург, Новочеркасский проспект, дом 26"
