,address,target_building_id,target_address
4900,"Адмиралтейская, д.17",41516,"Санкт-Петербург, город Колпино, Адмиралтейская улица, дом 17, литера А"
5304,"Веры Слуцкой, д.9",198693,"Санкт-Петербург, город Колпино, улица Веры Слуцкой, дом 9, литера А"
1343,"2-я Жерновская, д.26",79951,"г.Санкт-Петербург, 2-я Жерновская улица, дом 26, корпус 2, литера А"
1128,"Наставников, д.47",844,"г.Санкт-Петербург, проспект Наставников, дом 47, корпус 1, литера А"
5467,"1-й Предпортовый, д.14",99342,"г.Санкт-Петербург, 1-й Предпортовый проезд, дом 14, литера А"
4888,"Южная, д.23",109547,"Санкт-Петербург, посёлок Понтонный, Южная улица, дом 23, литера А"
4313,"Фермское, д.22",67518,"г.Санкт-Петербург, Фермское шоссе, дом 22, литера А"
738,"Руставели, д.4",93115,"г.Санкт-Петербург, улица Руставели, дом 4, литера А"
4340,"Долгоозёрная, д.5",22855,"г.Санкт-Петербург, Долгоозёрная улица, дом 5, корпус 1, литера А"
289,"Гражданский, д.33",71895,"г.Санкт-Петербург, Гражданский проспект, дом 33, литера А"
3567,"Богатырский, д.43",56126,"г.Санкт-Петербург, Богатырский проспект, дом 43, литера А"
4077,"Богатырский, д.59",12419,"г.Санкт-Петербург, Богатырский проспект, дом 59, корпус 1, литера А"
4013,"Шаврова, д.25",94194,"г.Санкт-Петербург, улица Шаврова, дом 25, корпус 1, литера А"
3035,"2-й Рабфаковский, д.10",85180,"г.Санкт-Петербург, 2-й Рабфаковский переулок, дом 10, литера Е"
3106,"Седова, д.97",9797,"г.Санкт-Петербург, улица Седова, дом 97, корпус 1, литера И"
3331,"Фарфоровская, д.24",97803,"г.Санкт-Петербург, Фарфоровская улица, дом 24, литера Н"
5039,"Клубная, д.1",31179,"Санкт-Петербург, посёлок Петро-Славянка, Клубная улица, дом 1, литера А"
4127,"Богатырский, д.25",25348,"г.Санкт-Петербург, Богатырский проспект, дом 25, корпус 1, литера А"
5320,"Загородная, д.37",105182,"Санкт-Петербург, город Колпино, Загородная улица, дом 37, литера А"
6522,"Кустодиева, д.14",14388,"г.Санкт-Петербург, улица Кустодиева, дом 14, литера А"
1096,"Металлистов, д.48",38403,"г.Санкт-Петербург, проспект Металлистов, дом 48, литера А"
6578,"Ярославский, д.31",221322,"г.Санкт-Петербург, Ярославский проспект, дом 31, строение 1"
5409,"Вокзальная, д.14",107848,"Санкт-Петербург, город Колпино, Вокзальная улица, дом 14, литера А"
91,"Северный, д.67",29745,"г.Санкт-Петербург, Северный проспект, дом 67, литера А"
1439,"Ленинский, д.51",141059,"г.Санкт-Петербург, Ленинский проспект, дом 51, литера А"
4942,"Октябрьская, д.59",90559,"Санкт-Петербург, город Колпино, Октябрьская улица, дом 59, литера А"
3550,"Беговая, д.7",9059,"г.Санкт-Петербург, Беговая улица, дом 7, корпус 1, литера А"
2067,"Балтийский, д.4",212888,"Санкт-Петербург, муниципальный округ Южно-Приморский, Балтийский бульвар, дом 4, строение 1"
6293,"Суздальский, д.9",15859,"г.Санкт-Петербург, Суздальский проспект, дом 9, литера А"
4701,"Комендантский, д.54",213562,"г.Санкт-Петербург, Комендантский проспект, дом 54, строение 1"
5299,"Веры Слуцкой, д.11",42383,"Санкт-Петербург, город Колпино, улица Веры Слуцкой, дом 11, литера А"
371,"Луначарского, д.108",5135,"г.Санкт-Петербург, проспект Луначарского, дом 108, корпус 1, литера А"
6598,"Диагональная, д.6",108660,"г.Санкт-Петербург, Диагональная улица, дом 6, литера А"
4030,"Школьная, д.24",30961,"г.Санкт-Петербург, Школьная улица, дом 24, литера А"
813,"Маршака, д.2",206489,"г.Санкт-Петербург, проспект Маршака, дом 2, корпус 1, литера А"
5096,"Ленина, д.67",113364,"Санкт-Петербург, город Колпино, проспект Ленина, дом 67, литера А"
1814,"Лётчика Пилютова, д.50",40596,"г.Санкт-Петербург, улица Лётчика Пилютова, дом 50, корпус 1, литера А"
4843,"Тельмана, д.30",104925,"г.Санкт-Петербург, улица Тельмана, дом 30, корпус 1, литера А"
2830,"Искровский, д.26",56460,"г.Санкт-Петербург, Искровский проспект, дом 26, литера А"
6014,"Художников, д.18",17111,"г.Санкт-Петербург, проспект Художников, дом 18, корпус 1, литера А"
6636,"Фёдора Абрамова, д.21",207969,"Санкт-Петербург, посёлок Парголово, улица Фёдора Абрамова, дом 21, корпус 1, литера А"
6069,"Энгельса, д.121",87400,"г.Санкт-Петербург, проспект Энгельса, дом 121, корпус 1, литера А"
2964,"Подвойского, д.15",68443,"г.Санкт-Петербург, улица Подвойского, дом 15, литера А"
272,"Гражданский, д.18",106178,"г.Санкт-Петербург, Гражданский проспект, дом 18, литера А"
2269,"Ленина, д.29",76102,"г.Санкт-Петербург, улица Ленина, дом 29, литера А"
5448,"Металлургов, д.13",73770,"Санкт-Петербург, город Колпино, улица Металлургов, дом 13, литера А"
674,"Раевского, д.7",48166,"г.Санкт-Петербург, проспект Раевского, дом 7, литера Я"
5014,"Вокзальная, д.12",101271,"Санкт-Петербург, посёлок Солнечное, Вокзальная улица, дом 12, корпус 1, литера А"
2120,"Здоровцева, д.25",6209,"г.Санкт-Петербург, улица Здоровцева, дом 25, литера А"
3288,"Клочков, д.12",130036,"г.Санкт-Петербург, Клочков переулок, дом 12, литера А"
1843,"Спирина, д.7",126566,"Санкт-Петербург, город Красное Село, улица Спирина, дом 7, корпус 1, литера А"
4972,"Тазаева, д.1",32810,"Санкт-Петербург, город Колпино, улица Тазаева, дом 1, литера А"
5098,"Ленина, д.81",31981,"Санкт-Петербург, город Колпино, проспект Ленина, дом 81, литера А"
6011,"Художников, д.13",6228,"г.Санкт-Петербург, проспект Художников, дом 13, корпус 1, литера А"
3509,"Авиаконструкторов, д.18",31660,"г.Санкт-Петербург, проспект Авиаконструкторов, дом 18, корпус 1, литера А"
2368,"Флотская, д.3",32910,"Санкт-Петербург, город Кронштадт, Флотская улица, дом 3, литера А"
3253,"Шелгунова, д.9",75227,"г.Санкт-Петербург, улица Шелгунова, дом 9, корпус 1, литера А"
3017,"Пятилеток, д.5",108223,"г.Санкт-Петербург, проспект Пятилеток, дом 5, литера А"
4246,"Богатырский, д.56",130403,"г.Санкт-Петербург, Богатырский проспект, дом 56, корпус 1, литера А"
5157,"Павловская, д.84",34094,"Санкт-Петербург, город Колпино, Павловская улица, дом 84, литера А"
2434,"Гражданская, д.18",54221,"г.Санкт-Петербург, Гражданская улица, дом 18, литера А"
4796,"Танкистов, д.6",91903,"Санкт-Петербург, город Колпино, улица Танкистов, дом 6, литера А"
4383,"Приморский, д.52",207974,"г.Санкт-Петербург, Приморский проспект, дом 52, корпус 1, литера А"
2363,"Флотская, д.17",56355,"Санкт-Петербург, город Кронштадт, Флотская улица, дом 17, литера А"
3669,"Камышовая, д.56",73487,"г.Санкт-Петербург, Камышовая улица, дом 56, корпус 1, литера А"
3787,"Новосибирская, д.5",3617,"г.Санкт-Петербург, Новосибирская улица, дом 5, литера А"
5376,"Трудящихся, д.35",18880,"Санкт-Петербург, город Колпино, бульвар Трудящихся, дом 35, корпус 1, литера А"
543,"Ушинского, д.41",21161,"г.Санкт-Петербург, улица Ушинского, дом 41, литера А"
4097,"Яхтенная, д.40",85645,"г.Санкт-Петербург, Яхтенная улица, дом 40, литера А"
1816,"Отважных, д.2",23260,"г.Санкт-Петербург, улица Отважных, дом 2, корпус 2, литера А"
6716,"Двинская, д.16",15577,"г.Санкт-Петербург, Двинская улица, дом 16, корпус 1, литера А"
1498,"Ветеранов, д.129",45369,"г.Санкт-Петербург, проспект Ветеранов, дом 129, корпус 2, литера А"
5497,"Костюшко, д.3",17998,"г.Санкт-Петербург, улица Костюшко, дом 3, литера А"
4616,"Комендантский, д.57",210847,"г.Санкт-Петербург, Комендантский проспект, дом 57, корпус 1, строение 1"
2586,"Новочеркасский, д.46",108727,"г.Санкт-Петербург, Новочеркасский проспект, дом 46, литера А"
4181,"Оптиков, д.47",131061,"г.Санкт-Петербург, улица Оптиков, дом 47, корпус 1, литера А"
3846,"Приморский, д.149",58343,"г.Санкт-Петербург, Приморский проспект, дом 149, корпус 1, литера А"
4544,"Савушкина, д.122",19513,"г.Санкт-Петербург, улица Савушкина, дом 122, корпус 2, литера А"
5557,"Свеаборгская, д.9",19741,"г.Санкт-Петербург, Свеаборгская улица, дом 9, литера А"
2217,"Карла Маркса, д.21",71804,"Санкт-Петербург, город Колпино, улица Карла Маркса, дом 21, литера А"
2815,"Елизарова, д.21",130050,"г.Санкт-Петербург, проспект Елизарова, дом 21, литера А"
5551,"Решетникова, д.19",95881,"г.Санкт-Петербург, улица Решетникова, дом 19, литера А"
6980,"Гусарская, д.4",50012,"Санкт-Петербург, город Пушкин, Гусарская улица, дом 4, литера А"
323,"Карпинского, д.13",85448,"г.Санкт-Петербург, улица Карпинского, дом 13, литера А"
3488,"Туристская, д.23",196697,"г.Санкт-Петербург, Туристская улица, дом 23, корпус 1, литера А"
2088,"Тамбасова, д.3",215762,"г.Санкт-Петербург, улица Тамбасова, дом 3, корпус 1, строение 1"
4051,"Яхтенная, д.10",17102,"г.Санкт-Петербург, Яхтенная улица, дом 10, корпус 1, литера А"
472,"Руставели, д.64",91101,"г.Санкт-Петербург, улица Руставели, дом 64, корпус 1, литера А"
7037,"Детскосельский, д.1",7161,"Санкт-Петербург, город Пушкин, Детскосельский бульвар, дом 1, литера А"
3295,"Стахановцев, д.17",49259,"г.Санкт-Петербург, улица Стахановцев, дом 17, литера А"
6174,"Культуры, д.19",31918,"г.Санкт-Петербург, проспект Культуры, дом 19, литера А"
1319,"Энтузиастов, д.38",3307,"г.Санкт-Петербург, проспект Энтузиастов, дом 38, литера А"
2682,"Бабушкина, д.135",82315,"г.Санкт-Петербург, улица Бабушкина, дом 135, литера Р"
6030,"Художников, д.31",90401,"г.Санкт-Петербург, проспект Художников, дом 31, корпус 1, литера А"
5500,"Костюшко, д.9",68182,"г.Санкт-Петербург, улица Костюшко, дом 9, литера А"
3832,"Парашютная, д.20",30753,"г.Санкт-Петербург, Парашютная улица, дом 20, корпус 1, литера А"
6786,"Народного Ополчения, д.49",18804,"г.Санкт-Петербург, проспект Народного Ополчения, дом 49, литера А"
399,"Науки, д.20",109289,"г.Санкт-Петербург, проспект Науки, дом 20, литера А"
5977,"Сикейроса, д.6",131020,"г.Санкт-Петербург, улица Сикейроса, дом 6, корпус 1, литера А"
5927,"Светлановский, д.113",11495,"г.Санкт-Петербург, Светлановский проспект, дом 113, корпус 1, литера А"
6574,"Энгельса, д.125",35514,"г.Санкт-Петербург, проспект Энгельса, дом 125, литера А"
6550,"Сикейроса, д.11",91665,"г.Санкт-Петербург, улица Сикейроса, дом 11, корпус 1, литера А"
6630,"Архитектора Белова, д.5",214592,"Санкт-Петербург, посёлок Парголово, улица Архитектора Белова, дом 5, корпус 1, строение 1"
6022,"Художников, д.24",10429,"г.Санкт-Петербург, проспект Художников, дом 24, корпус 1, литера А"
5782,"Большой Сампсониевский, д.85",49217,"г.Санкт-Петербург, Большой Сампсониевский проспект, дом 85, корпус 1, литера А"
890,"Муринская, д.55",215212,"г.Санкт-Петербург, Муринская дорога, дом 55, корпус 1, строение 1"
5910,"Руднева, д.29",101643,"г.Санкт-Петербург, улица Руднева, дом 29, корпус 1, литера А"
5339,"Загородная, д.60",14616,"Санкт-Петербург, город Колпино, Загородная улица, дом 60, литера А"
6162,"Культуры, д.12",102397,"г.Санкт-Петербург, проспект Культуры, дом 12, корпус 1, литера А"
609,"Институтский, д.3",93799,"г.Санкт-Петербург, Институтский проспект, дом 3, корпус 1, литера А"
158,"Академика Константинова, д.4",87970,"г.Санкт-Петербург, улица Академика Константинова, дом 4, корпус 1, литера А"
2828,"Искровский, д.21",70714,"г.Санкт-Петербург, Искровский проспект, дом 21, литера А"
5542,"Пулковское, д.7",74739,"г.Санкт-Петербург, Пулковское шоссе, дом 7, корпус 2, литера А"
978,"Белорусская, д.16",87275,"г.Санкт-Петербург, Белорусская улица, дом 16, корпус 2, литера А"
3618,"Земский, д.9",60540,"г.Санкт-Петербург, Земский переулок, дом 9, литера А"
6760,"Трамвайный, д.21",30444,"г.Санкт-Петербург, Трамвайный проспект, дом 21, корпус 1, литера А"
5171,"Пролетарская, д.13",48086,"Санкт-Петербург, город Колпино, Пролетарская улица, дом 13, литера А"
6036,"Художников, д.4",46280,"г.Санкт-Петербург, проспект Художников, дом 4, корпус 1, литера А"
2486,"Юрия Инге, д.11",63607,"Санкт-Петербург, город Кронштадт, улица Юрия Инге, дом 11, литера А"
6778,"Народного Ополчения, д.33",23816,"г.Санкт-Петербург, проспект Народного Ополчения, дом 33, литера А"
5220,"Тверская, д.33",70376,"Санкт-Петербург, город Колпино, Тверская улица, дом 33, литера А"
1207,"Среднеохтинский, д.20",63899,"г.Санкт-Петербург, Среднеохтинский проспект, дом 20, литера А"
3875,"Савушкина, д.109",67339,"г.Санкт-Петербург, улица Савушкина, дом 109, корпус 1, литера А"
3565,"Богатырский, д.4",36545,"г.Санкт-Петербург, Богатырский проспект, дом 4, литера А"
6789,"Народного Ополчения, д.55",99797,"г.Санкт-Петербург, проспект Народного Ополчения, дом 55, литера А"
2400,"Широкая, д.2/5",76244,"Санкт-Петербург, город Пушкин, Широкая улица, дом 2, литера А"
1865,"Театральная, д.1",198017,"г.Санкт-Петербург, Театральная площадь, дом 1, литера А"
4894,"Веры Слуцкой, д.38",43583,"Санкт-Петербург, город Колпино, улица Веры Слуцкой, дом 38, литера А"
3767,"Маршала Новикова, д.10",91969,"г.Санкт-Петербург, улица Маршала Новикова, дом 10, корпус 1, литера А"
4993,"Заводской, д.38",67170,"Санкт-Петербург, город Колпино, Заводской проспект, дом 38, литера А"
677,"Кушелевская, д.3",204931,"г.Санкт-Петербург, Кушелевская дорога, дом 3, корпус 1, литера А"
6240,"Луначарского, д.74",35682,"г.Санкт-Петербург, проспект Луначарского, дом 74, литера А"
4745,"Бухарестская, д.11",42934,"г.Санкт-Петербург, Бухарестская улица, дом 11, литера А"
2612,"Шаумяна, д.32",16018,"г.Санкт-Петербург, проспект Шаумяна, дом 32, литера А"
7128,"Камероновская, д.3",218069,"Санкт-Петербург, город Пушкин, Камероновская улица, дом 3, корпус 1, строение 1"
3785,"Новосибирская, д.19",86911,"г.Санкт-Петербург, Новосибирская улица, дом 19, литера А"
2552,"Заневский, д.22",4711,"г.Санкт-Петербург, Заневский проспект, дом 22, литера А"
2243,"Кронштадтская, д.17",44080,"Санкт-Петербург, город Кронштадт, Кронштадтская улица, дом 17, литера А"
5628,"Заозёрная, д.3",130820,"г.Санкт-Петербург, Заозёрная улица, дом 3, литера А"
1652,"Отважных, д.5",4139,"г.Санкт-Петербург, улица Отважных, дом 5, литера А"
5915,"Руднева, д.4",52944,"г.Санкт-Петербург, улица Руднева, дом 4, литера А"
3269,"Казанская (Малая Охта), д.20",31804,"г.Санкт-Петербург, Малая Охта, Казанская улица, дом 20, литера А"
5430,"Центральная, д.17",68513,"Санкт-Петербург, город Ломоносов, Центральная улица, дом 17, литера А"
1133,"Новочеркасский, д.37",1436,"г.Санкт-Петербург, Новочеркасский проспект, дом 37, корпус 1, литера А"
2407,"Юрия Инге, д.3",196786,"Санкт-Петербург, город Кронштадт, улица Юрия Инге, дом 3, литера А"
6513,"Ивана Фомина, д.14",34313,"г.Санкт-Петербург, улица Ивана Фомина, дом 14, корпус 1, литера А"
2477,"Мануильского, д.5",103990,"Санкт-Петербург, город Кронштадт, улица Мануильского, дом 5, литера А"
1872,"Маршала Захарова, д.14",90477,"г.Санкт-Петербург, улица Маршала Захарова, дом 14, корпус 2, литера А"
3762,"Мартыновская, д.12",16323,"г.Санкт-Петербург, Мартыновская улица, дом 12, корпус 1, литера А"
4100,"Торжковская, д.7",106319,"г.Санкт-Петербург, Торжковская улица, дом 7, литера А"
652,"Институтский, д.11",186214,"г.Санкт-Петербург, Институтский проспект, дом 11, литера А"
5242,"Тосненский, д.32",37557,"Санкт-Петербург, город Колпино, Тосненский переулок, дом 32, литера А"
6141,"Демьяна Бедного, д.28",54358,"г.Санкт-Петербург, улица Демьяна Бедного, дом 28, корпус 1, литера А"
5183,"Пролетарская, д.67",90065,"Санкт-Петербург, город Колпино, Пролетарская улица, дом 67, литера А"
5466,"Предпортовая, д.4",72493,"г.Санкт-Петербург, Предпортовая улица, дом 4, корпус 2, литера А"
2375,"Посадская, д.16",49593,"г.Санкт-Петербург, Малая Посадская улица, дом 16, литера А"
6891,"Алексея Толстого, д.13",21459,"Санкт-Петербург, город Пушкин, бульвар Алексея Толстого, дом 13, корпус 1, литера А"
1554,"Добровольцев, д.24",4343,"г.Санкт-Петербург, улица Добровольцев, дом 24, литера А"
744,"Тихорецкий, д.11",97798,"г.Санкт-Петербург, Тихорецкий проспект, дом 11, литера А"
4006,"Чёрной речки, д.22",67331,"г.Санкт-Петербург, набережная Чёрной речки, дом 22, литера А"
1588,"2-я Комсомольская, д.16",112463,"г.Санкт-Петербург, 2-я Комсомольская улица, дом 16, корпус 2, литера А"
6580,"Ярославский, д.62",7450,"г.Санкт-Петербург, Ярославский проспект, дом 62, литера А"
1501,"Ветеранов, д.139",93048,"г.Санкт-Петербург, проспект Ветеранов, дом 139, корпус 1, литера А"
5714,"Сантьяго-де-Куба, д.2",105892,"г.Санкт-Петербург, улица Сантьяго-де-Куба, дом 2, корпус 1, литера А"
5517,"Московский, д.191",8215,"г.Санкт-Петербург, Московский проспект, дом 191, литера А"
4452,"Матроса Железняка, д.35",73745,"г.Санкт-Петербург, улица Матроса Железняка, дом 35, литера А"
6540,"Руднева, д.27",41407,"г.Санкт-Петербург, улица Руднева, дом 27, корпус 1, литера Ж"
